img_url,card_name,double-sided,cost
https://cards.scryfall.io/large/front/f/f/ff5987ab-570a-426c-ae4a-a270fac6b346.jpg?1593095759,"King Macar, the Gold-Cursed (Journey into Nyx #74)",False,4
https://cards.scryfall.io/large/front/c/c/cc857755-62e6-4d29-95f5-82f5d4bde522.jpg?1686969851,King of the Oathbreakers (The Lord of the Rings: Tales of Middle-earth #211),False,4
https://cards.scryfall.io/large/front/6/3/63cda4a0-0dff-4edb-ae67-a2b7e2971350.jpg?1591228085,"Kinnan, Bonder Prodigy (Ikoria: Lair of Behemoths #192)",False,2
https://cards.scryfall.io/large/front/2/8/28934cf3-c1e0-49c9-93ce-fd60b1881884.jpg?1675957442,Kinzu of the Bleak Coven (Phyrexia: All Will Be One #406),False,5
https://cards.scryfall.io/large/front/c/2/c23a2d6b-43c2-4756-94c7-207cc344f0a7.jpg?1703899662,"Ratchet, Field Medic // Ratchet, Rescue Racer (Transformers #2)",True,1
https://cards.scryfall.io/large/front/3/b/3b73a314-b197-4954-a242-7d9096a406c1.jpg?1708742607,"Raul, Trouble Shooter (Fallout #115)",False,2
https://cards.scryfall.io/large/front/f/2/f2725635-8f90-4d17-9568-51218ba663c1.jpg?1562425381,"Ravos, Soultender (Commander 2016 #39)",False,2
https://cards.scryfall.io/large/front/6/9/6997ad62-f34c-4490-aee4-6d5c08e14709.jpg?1654667344,"Rayami, First of the Fallen (Commander 2019 #48)",False,3
https://cards.scryfall.io/large/front/8/e/8ee6480c-7697-47e2-893b-ca88c0ab3376.jpg?1562444698,"Rayne, Academy Chancellor (Urza's Destiny #43)",False,1
https://cards.scryfall.io/large/front/d/6/d6bb956d-0df6-4910-9320-55f2c5674d98.jpg?1689997402,"Razaketh, the Foulblooded (Commander Masters #181)",False,3
https://cards.scryfall.io/large/front/8/7/87e80447-9572-43a7-8487-3249cd9ce596.jpg?1562842621,"Razia, Boros Archangel (Planechase #92)",False,4
https://cards.scryfall.io/large/front/5/0/502740bf-0bff-4358-8996-1a27e5f0343f.jpg?1562830062,Reaper King (Shadowmoor #260),False,0
https://cards.scryfall.io/large/front/4/6/46975250-950f-4f5d-a7c5-f61aec8e40ad.jpg?1608908966,"Rebbec, Architect of Ascension (Commander Legends #42)",False,1
https://cards.scryfall.io/large/front/e/d/edf616fa-b9a0-4f7a-b7ee-32ce3a08d466.jpg?1708742615,"Red Death, Shipwrecker (Fallout #116)",False,2
https://cards.scryfall.io/large/front/1/5/1586ead9-4045-4f72-b68d-bef8d496f27c.jpg?1665000765,"Reezug, the Bonecobbler (Alchemy: Dominaria #10)",False,1
https://cards.scryfall.io/large/front/0/c/0c2bf475-9845-40ed-9f55-669325fb6183.jpg?1562897463,"Regna, the Redeemer (Battlebond #3)",False,1
https://cards.scryfall.io/large/front/3/6/3606519e-5677-4c21-a34e-be195b6669fa.jpg?1631046015,"Reidane, God of the Worthy // Valkmira, Protector's Shield (Kaldheim #21)",True,1
https://cards.scryfall.io/large/front/8/6/86317339-5a39-41eb-8aee-5ea926da8cd4.jpg?1593860751,"Reki, the History of Kamigawa (Saviors of Kamigawa #142)",False,1
https://cards.scryfall.io/large/front/b/3/b31e307a-9689-4e11-8c5f-96b7a4b50bed.jpg?1636684729,"Rem Karolus, Stalwart Slayer (Innistrad: Midnight Hunt #235)",False,2
https://cards.scryfall.io/large/front/1/c/1c044363-d661-4703-841c-8279fa4aa5e5.jpg?1674135745,"Renari, Merchant of Marvels (Commander Legends: Battle for Baldur's Gate #90)",False,1
https://cards.scryfall.io/large/front/2/b/2b27e6b2-13ad-42b2-a121-70935913723d.jpg?1581480865,"Renata, Called to the Hunt (Theros Beyond Death #196)",False,2
https://cards.scryfall.io/large/front/2/7/27c32cc5-b4da-4345-9118-1fe46a5049cb.jpg?1562903439,"Reveka, Wizard Savant (Masters Edition III #49)",False,2
https://cards.scryfall.io/large/front/d/a/dae95822-d4a9-4698-bd11-c504414fc160.jpg?1708742624,"Rex, Cyber-Hound (Fallout #117)",False,2
https://cards.scryfall.io/large/front/4/4/44b45bdd-829a-4fc1-ad37-17c2bd57fac8.jpg?1559959227,Reya Dawnbringer (Ultimate Masters #32),False,3
https://cards.scryfall.io/large/front/9/0/90307dd6-196d-4d51-9b3f-6ff339882d31.jpg?1608911232,"Reyav, Master Smith (Commander Legends #290)",False,2
https://cards.scryfall.io/large/front/8/a/8afad106-a49b-4910-959e-228c109ea983.jpg?1644853038,"Reyhan, Last of the Abzan (Commander Anthology Volume II #13)",False,2
https://cards.scryfall.io/large/front/c/4/c434e774-c908-46b9-ba18-52e1efe092de.jpg?1641600313,"Rhoda, Geist Avenger (Crimson Vow Commander #8)",False,1
https://cards.scryfall.io/large/front/5/0/50f23c47-278c-4188-8fb4-ae20a0c423c5.jpg?1543675944,Rhonas the Indomitable (Amonkhet #182),False,1
https://cards.scryfall.io/large/front/d/7/d7c25806-1da6-4789-a17e-d2440184ec40.jpg?1675957444,"Rhuk, Hexgold Nabber (Phyrexia: All Will Be One #407)",False,1
https://cards.scryfall.io/large/front/8/5/85004079-f9fa-4a05-904d-a77782c4165c.jpg?1631235143,Rhys the Exiled (Kaldheim Commander #73),False,1
https://cards.scryfall.io/large/front/b/9/b91dadcb-31e9-43b0-b425-c9311af3e9d7.jpg?1599708272,Rhys the Redeemed (Double Masters #213),False,1
https://cards.scryfall.io/large/front/f/7/f7531ed3-235f-4368-98a8-e4e1947c53fb.jpg?1675957209,"Ria Ivor, Bane of Bladehold (Phyrexia: All Will Be One #214)",False,2
https://cards.scryfall.io/large/front/6/1/616a3755-f08c-4b8f-954b-7e3f3a8fa71f.jpg?1583965480,"Richard Garfield, Ph.D. (Unsanctioned #26)",False,2
https://cards.scryfall.io/large/front/e/d/ed33af8b-d1e9-4298-852c-c9ba7f50e2e7.jpg?1680464127,"Richlau, Headmaster (Alchemy: The Brothers' War #23)",False,2
https://cards.scryfall.io/large/front/5/f/5f03c944-1929-4cb2-a373-d57eefa29ed1.jpg?1591228198,"Rielle, the Everwise (Ikoria: Lair of Behemoths #203)",False,2
https://cards.scryfall.io/large/front/7/8/78660bdf-0edb-4fd0-a737-1c95f93cced1.jpg?1673305646,"Rienne, Angel of Rebirth (Dominaria United Commander #166)",False,3
https://cards.scryfall.io/large/front/6/7/67c6aef6-d846-4e02-a5f9-6eb0b2212208.jpg?1664413619,"Rigo, Streetwise Mentor (Streets of New Capenna #215)",False,3
https://cards.scryfall.io/large/front/7/0/70dd138f-391a-4956-bc2a-fe186429c71a.jpg?1599708286,Riku of Two Reflections (Double Masters #214),False,3
https://cards.scryfall.io/large/front/5/4/54484439-6f8a-47f1-8d62-4689af7f00c2.jpg?1674137671,"Rilsa Rael, Kingpin (Commander Legends: Battle for Baldur's Gate #293)",False,2
https://cards.scryfall.io/large/front/d/6/d605c780-a42a-4816-8fb9-63e3114a8246.jpg?1677724018,"Rin and Seri, Inseparable (Core Set 2021 #278)",False,3
https://cards.scryfall.io/large/front/b/1/b1e92b9c-4234-436d-a741-37c5e45859e5.jpg?1625192099,"Rionya, Fire Dancer (Commander 2021 #55)",False,2
https://cards.scryfall.io/large/front/8/8/88f4aecc-b728-4960-8131-1e5aa6c3c030.jpg?1690016969,"Rishkar, Peema Renegade (Commander Masters #317)",False,1
https://cards.scryfall.io/large/front/5/1/51d8f1fa-ca92-4e2e-91e8-195bdad82def.jpg?1654568577,"Risona, Asari Commander (Kamigawa: Neon Dynasty #233)",False,2
https://cards.scryfall.io/large/front/a/c/ac148784-b7b6-4aae-bffb-a4cf09f56971.jpg?1673308054,"Rith, Liberated Primeval (Dominaria United #214)",False,3
https://cards.scryfall.io/large/front/e/1/e1a75961-39a3-4221-9367-a763cf871d42.jpg?1675200740,"Rith, the Awakener (Dominaria Remastered #198)",False,3
https://cards.scryfall.io/large/front/9/a/9a47573a-601e-4738-acef-16118289f939.jpg?1673308061,Rivaz of the Claw (Dominaria United #215),False,2
https://cards.scryfall.io/large/front/e/d/ed665227-02ba-4977-a8e7-ea4e46a626e6.jpg?1562945004,Riven Turnbull (Masters Edition III #171),False,2
https://cards.scryfall.io/large/front/a/1/a1efb084-d2a0-44c4-a89d-6445156bb298.jpg?1696636758,River Song (Doctor Who #152),False,2
https://cards.scryfall.io/large/front/a/5/a52a5f4b-d2e1-405e-82b4-ea35ab851c42.jpg?1673485159,"Roalesk, Apex Hybrid (New Capenna Commander #349)",False,3
https://cards.scryfall.io/large/front/b/6/b6cf8b35-2a81-40fd-b383-becb81bef806.jpg?1664413683,"Rocco, Cabaretti Caterer (Streets of New Capenna #218)",False,3
https://cards.scryfall.io/large/front/c/d/cdb53ce7-845c-4c62-98a9-4fc33c67a07b.jpg?1684340828,"Rocco, Street Chef (March of the Machine: The Aftermath #44)",False,3
https://cards.scryfall.io/large/front/d/9/d9afd47b-ff94-4fdd-bb04-bdf9b8b61a6d.jpg?1682896157,Rodolf Duskbringer (Jumpstart 2022 #25),False,1
https://cards.scryfall.io/large/front/a/4/a4fab67f-00c2-4125-9262-d21a29411797.jpg?1644853041,"Rograkh, Son of Rohgahh (Commander Legends #197)",False,1
https://cards.scryfall.io/large/front/8/4/84e87400-cc3f-4476-b177-2c36a65f277b.jpg?1673304981,"Rohgahh, Kher Keep Overlord (Dominaria United Commander #41)",False,2
https://cards.scryfall.io/large/front/1/4/1429cc3d-f6a2-4011-b716-5c3e0cf251d0.jpg?1562899257,Rohgahh of Kher Keep (Masters Edition III #172),False,4
https://cards.scryfall.io/large/front/4/c/4ccc3ebd-34e1-421c-87b4-0be905954289.jpg?1696691793,Romana II (Doctor Who #27),False,1
https://cards.scryfall.io/large/front/4/5/45420f5e-f7f8-4db7-9b54-e2fa1be22094.jpg?1562734878,"Rona, Disciple of Gix (Dominaria #203)",False,2
https://cards.scryfall.io/large/front/f/4/f487b582-e73f-4325-939f-95fc5a9aba49.jpg?1682203390,"Rona, Herald of Invasion // Rona, Tolarian Obliterator (March of the Machine #75)",True,1
https://cards.scryfall.io/large/front/c/c/cc8331ab-adc9-45c6-9728-66afc72d901c.jpg?1673308068,"Rona, Sheoldred's Faithful (Dominaria United #216)",False,3
https://cards.scryfall.io/large/front/5/4/54e2d6c2-a233-4e37-94c9-673a4a957e0c.jpg?1673149092,Roon of the Hidden Realm (Double Masters 2022 #270),False,3
https://cards.scryfall.io/large/front/a/c/acb8f24d-8d1d-48aa-a534-238e969a474c.jpg?1624739798,"Rootha, Mercurial Artist (Strixhaven: School of Mages #227)",False,2
https://cards.scryfall.io/large/front/3/2/32668329-2f62-48ed-8da3-3cb0c3692ed9.jpg?1690016965,Rorix Bladewing (Commander Masters #251),False,3
https://cards.scryfall.io/large/front/f/5/f51a010d-641c-413f-8f91-0c8ff3b2085c.jpg?1696636758,Rory Williams (Doctor Who #153),False,2
https://cards.scryfall.io/large/front/f/8/f803a510-99fe-467a-be3b-9301497ec7ec.jpg?1708742209,"Rose, Cutthroat Raider (Fallout #66)",False,2
https://cards.scryfall.io/large/front/3/9/39edd98a-2ee9-4799-9194-5b5a3efb6255.jpg?1707370988,Rose Noble (Secret Lair Drop #1580),False,1
https://cards.scryfall.io/large/front/3/a/3aa8d034-f98c-4e27-b6af-850eadf59941.jpg?1696691620,Rose Tyler (Doctor Who #5),False,1
https://cards.scryfall.io/large/front/4/7/472efa7f-203f-4c48-b9ad-505e18f2976f.jpg?1562848454,Rosheen Meanderer (Iconic Masters #206),False,1
https://cards.scryfall.io/large/front/7/5/75338f49-1f02-4333-87e4-5779ef14e688.jpg?1686967894,Rosie Cotton of South Lane (The Lord of the Rings: Tales of Middle-earth #27),False,1
https://cards.scryfall.io/large/front/0/1/013e33d4-7d08-4773-a570-469ae3cf92f2.jpg?1673304869,"Rosnakht, Heir of Rohgahh (Dominaria United Commander #25)",False,1
https://cards.scryfall.io/large/front/e/4/e4f250af-01fb-41dd-b6da-8b636166058f.jpg?1677508195,"Rothga, Bonded Engulfer (Alchemy: Phyrexia #14)",False,2
https://cards.scryfall.io/large/front/b/c/bcf0514e-63b3-4695-93ae-527524d48c25.jpg?1674142098,Rowan Kenrith (Commander Legends: Battle for Baldur's Gate #805),False,2
https://cards.scryfall.io/large/front/4/e/4ee179ab-a15b-4bd6-b7f8-1e1abeeb31b7.jpg?1692939409,"Rowan, Scion of War (Wilds of Eldraine #211)",False,2
https://cards.scryfall.io/large/front/f/7/f7999a76-35b0-43de-8d13-8fc0d447a9d1.jpg?1673914969,"Roxi, Publicist to the Stars (Unfinity #177)",False,2
https://cards.scryfall.io/large/front/c/e/ce216785-aa81-44b4-9562-9b7eca743a0c.jpg?1592673455,Rubinia Soulsinger (Commander Anthology #191),False,3
https://cards.scryfall.io/large/front/f/f/ffb5786b-6825-4ebf-a1e1-80011340adbb.jpg?1692939424,"Ruby, Daring Tracker (Wilds of Eldraine #212)",False,2
https://cards.scryfall.io/large/front/7/f/7fa40fde-2c11-4dec-b788-01f8d90198df.jpg?1592714235,Ruhan of the Fomori (Commander 2011 #221),False,3
https://cards.scryfall.io/large/front/0/b/0b2f7397-9d75-4667-8872-e58a39512583.jpg?1691497909,"Rukarumel, Biologist (Commander Masters #711)",False,5
https://cards.scryfall.io/large/front/3/f/3fa49711-473d-4774-99b8-2bfbabc6b735.jpg?1673308075,"Rulik Mons, Warren Chief (Dominaria United #217)",False,3
https://cards.scryfall.io/large/front/f/4/f4f5500f-e82c-44f3-8be8-cee4c86824b1.jpg?1675644838,"Runadi, Behemoth Caller (Jumpstart 2022 #44)",False,1
https://cards.scryfall.io/large/front/4/2/42ba0e13-d20f-47f9-9c86-2b0b13c39ada.jpg?1562493487,"Rune-Tail, Kitsune Ascendant // Rune-Tail's Essence (Saviors of Kamigawa #27)",True,1
https://cards.scryfall.io/large/front/f/6/f6c0fca5-b759-4543-95e2-8d712aae5281.jpg?1643594355,"Runo Stromkirk // Krothuss, Lord of the Deep (Innistrad: Crimson Vow #246)",True,2
https://cards.scryfall.io/large/front/a/a/aa828bdc-221e-4e81-9e71-6f288690ddcd.jpg?1673149099,"Ruric Thar, the Unbowed (Double Masters 2022 #271)",False,2
https://cards.scryfall.io/large/front/0/1/01b4c54e-7950-4183-a69d-39a777f424bc.jpg?1680464136,"Rusko, Clockmaker (Alchemy: The Brothers' War #24)",False,2
https://cards.scryfall.io/large/front/e/0/e07b8142-6a49-46e7-b862-41f89a59b894.jpg?1681953511,"Ruxa, Patient Professor (Commander 2021 #66)",False,2
https://cards.scryfall.io/large/front/4/2/42684d97-fce6-4a96-9c64-20e2cb382dca.jpg?1696691786,Ryan Sinclair (Doctor Who #94),False,1
https://cards.scryfall.io/large/front/6/8/68d57ab8-fbe0-4f01-b7f7-2a5cccd2d13a.jpg?1674142106,"Ryusei, the Falling Star (Commander Legends: Battle for Baldur's Gate #806)",False,1
https://cards.scryfall.io/large/front/4/c/4c45b36f-b879-417c-b284-0176990fb9f9.jpg?1562759878,"Sachi, Daughter of Seshiro (Champions of Kamigawa #238)",False,2
https://cards.scryfall.io/large/front/e/9/e9367f66-6556-459c-a43d-5ba7a84b568d.jpg?1674136257,"Safana, Calimport Cutthroat (Commander Legends: Battle for Baldur's Gate #143)",False,1
https://cards.scryfall.io/large/front/4/1/4176dda4-ec5c-4734-bb48-0876304aa219.jpg?1619404114,Saffi Eriksdotter (Time Spiral Remastered #260),False,2
https://cards.scryfall.io/large/front/c/a/ca095559-ac77-4186-8d9b-b75ce0607582.jpg?1592710284,"Saheeli, the Gifted (Commander 2018 #44)",False,2
https://cards.scryfall.io/large/front/0/b/0ba99b60-c7d0-4041-a065-f2c510745223.jpg?1699044570,"Saheeli, the Sun's Brilliance (The Lost Caverns of Ixalan #239)",False,2
https://cards.scryfall.io/large/front/a/d/ad0b5c09-5075-408e-84c5-1095354ac53e.jpg?1689996602,"Sai, Master Thopterist (Commander Masters #118)",False,1
https://cards.scryfall.io/large/front/5/5/55a45de4-cc76-4aa0-a1dc-24df8e495215.jpg?1701606017,Saint Traft and Rem Karolus (March of the Machine Commander #9),False,3
https://cards.scryfall.io/large/front/7/1/714c3a1f-7b30-4ed8-8f38-6176758741fb.jpg?1608909400,Sakashima of a Thousand Faces (Commander Legends #89),False,1
https://cards.scryfall.io/large/front/6/1/61dc2f54-3637-4caa-9741-36ff14dc5527.jpg?1562494177,Sakashima the Impostor (Saviors of Kamigawa #53),False,2
https://cards.scryfall.io/large/front/8/d/8dbdb5f5-cd6e-47cd-b83d-ff71b00c369e.jpg?1689998837,"Sakiko, Mother of Summer (Commander Masters #319)",False,2
https://cards.scryfall.io/large/front/b/3/b33354a5-d99a-46dd-8715-34dbc5f0ec3b.jpg?1696636763,Sally Sparrow (Doctor Who #155),False,2
https://cards.scryfall.io/large/front/6/8/687a2b76-3f05-4732-bd9b-513d06d16300.jpg?1686963755,"Sam, Loyal Attendant (Tales of Middle-earth Commander #7)",False,2
https://cards.scryfall.io/large/front/a/0/a0f3fdb0-47ad-4df6-a95c-a2c81aaf7af5.jpg?1684340837,"Samut, Vizier of Naktamun (March of the Machine: The Aftermath #45)",False,2
https://cards.scryfall.io/large/front/6/0/60f2d8f1-43a9-438a-830c-9d6b5701f950.jpg?1543676097,"Samut, Voice of Dissent (Amonkhet #205)",False,2
https://cards.scryfall.io/large/front/a/1/a1b6f13e-63d0-46bf-aa57-23c2dbdf62dd.jpg?1686969973,Samwise Gamgee (The Lord of the Rings: Tales of Middle-earth #222),False,2
https://cards.scryfall.io/large/front/2/1/214c270e-29ca-4d69-bea6-9252ae7707ad.jpg?1686967902,Samwise the Stouthearted (The Lord of the Rings: Tales of Middle-earth #28),False,1
https://cards.scryfall.io/large/front/7/0/70cb4359-8e57-4d1a-bf1f-c188555376ce.jpg?1688125582,"Sanwell, Avenger Ace (The Brothers' War Commander #5)",False,1
https://cards.scryfall.io/large/front/3/3/33c19062-9e1c-4cae-bb97-7ca9e4523593.jpg?1625978030,Sapling of Colfenor (Commander 2021 #228),False,2
https://cards.scryfall.io/large/front/a/6/a65a1fb5-cc2c-4556-b109-05c3d966ded9.jpg?1688318298,"Saradoc, Master of Buckland (The Lord of the Rings: Tales of Middle-earth #282)",False,1
https://cards.scryfall.io/large/front/1/b/1ba76f68-e647-4786-903c-92dbd3cef05d.jpg?1696691789,Sarah Jane Smith (Doctor Who #6),False,1
https://cards.scryfall.io/large/front/4/0/4009d5ab-945d-43c3-9077-f10f96249fc4.jpg?1674136269,"Sarevok, Deathbringer (Commander Legends: Battle for Baldur's Gate #144)",False,1
https://cards.scryfall.io/large/front/c/4/c41156c8-ddd1-4492-ab0f-02c4a7423181.jpg?1656626046,Sarevok the Usurper (Alchemy Horizons: Baldur's Gate #9),False,1
https://cards.scryfall.io/large/front/6/2/6225f139-f6eb-4eb5-9776-159a599d8255.jpg?1684340846,"Sarkhan, Soul Aflame (March of the Machine: The Aftermath #46)",False,2
https://cards.scryfall.io/large/front/b/c/bcecf9ba-36da-490a-9460-99ff87d99fbd.jpg?1631051850,"Sarulf, Realm Eater (Kaldheim #228)",False,2
https://cards.scryfall.io/large/front/8/c/8cfcc7ec-87a2-4712-8d82-217bd8600891.jpg?1686969983,Saruman of Many Colors (The Lord of the Rings: Tales of Middle-earth #223),False,3
https://cards.scryfall.io/large/front/1/b/1bfccbab-29fa-4e92-8919-6cd4815fb655.jpg?1686968266,Saruman the White (The Lord of the Rings: Tales of Middle-earth #67),False,1
https://cards.scryfall.io/large/front/6/4/6487ccbf-f6cd-45a6-8514-2c458b655ef2.jpg?1686963765,"Saruman, the White Hand (Tales of Middle-earth Commander #8)",False,3
https://cards.scryfall.io/large/front/8/0/8050afb7-3c16-4456-aa34-4cc999fac7f5.jpg?1706240929,"Saryth, the Viper's Fang (Murders at Karlov Manor Commander #185)",False,2
https://cards.scryfall.io/large/front/d/2/d224c50f-8146-4c91-9401-04e5bd306d02.jpg?1562496100,"Sasaya, Orochi Ascendant // Sasaya's Essence (Saviors of Kamigawa #145)",True,2
https://cards.scryfall.io/large/front/5/b/5b483db6-b614-4af1-820a-42a4ee0c8707.jpg?1562401580,Saskia the Unyielding (Commander 2016 #41),False,4
https://cards.scryfall.io/large/front/8/8/8887f26d-b097-4fbc-9c48-bdc656409a32.jpg?1654568594,Satoru Umezawa (Kamigawa: Neon Dynasty #234),False,2
https://cards.scryfall.io/large/front/0/1/0152575b-31b0-4142-9cc2-b87a81bd51a8.jpg?1654568597,"Satsuki, the Living Lore (Kamigawa: Neon Dynasty #235)",False,2
https://cards.scryfall.io/large/front/f/c/fc53dec0-79fe-4f6f-9d5b-cf298588e808.jpg?1686963724,"Sauron, Lord of the Rings (Tales of Middle-earth Commander #4)",False,3
https://cards.scryfall.io/large/front/0/3/034e0929-b2c7-4b5f-94f2-8eaf4fb1a2a1.jpg?1693611218,"Sauron, the Dark Lord (The Lord of the Rings: Tales of Middle-earth #224)",False,3
https://cards.scryfall.io/large/front/d/8/d82a4c78-d2fc-425a-8d0e-2e64509a08f1.jpg?1687424758,"Sauron, the Lidless Eye (The Lord of the Rings: Tales of Middle-earth #288)",False,2
https://cards.scryfall.io/large/front/3/7/377d65d8-21c8-4292-97db-610e0173ba59.jpg?1686968699,"Sauron, the Necromancer (The Lord of the Rings: Tales of Middle-earth #106)",False,2
https://cards.scryfall.io/large/front/e/1/e189f09e-d637-4631-bae3-a5a583ada429.jpg?1702429705,"Savra, Queen of the Golgari (Ravnica Remastered #218)",False,2
https://cards.scryfall.io/large/front/c/8/c876f9b3-b4f6-4177-9c43-443ae2a028d0.jpg?1674136278,Scion of Halaster (Commander Legends: Battle for Baldur's Gate #145),False,1
https://cards.scryfall.io/large/front/5/6/565b2a40-57b1-451f-8c2a-e02222502288.jpg?1562608891,Scion of the Ur-Dragon (Commander 2017 #192),False,5
https://cards.scryfall.io/large/front/a/4/a4e787a7-3721-4ba7-b643-a103488cfc8a.jpg?1673149122,"Sedris, the Traitor King (Double Masters 2022 #274)",False,3
https://cards.scryfall.io/large/front/d/3/d30255f6-e058-476a-b377-2ee4c9178ed1.jpg?1632335385,Sefris of the Hidden Ways (Forgotten Realms Commander #3),False,3
https://cards.scryfall.io/large/front/e/1/e1e61750-f7d7-4e6d-9d68-e1e357868a8d.jpg?1587857636,"Seizan, Perverter of Truth (Champions of Kamigawa #143)",False,2
https://cards.scryfall.io/large/front/9/8/9883e973-54c3-4bec-91d8-22f2829cdfa2.jpg?1562495122,"Sekki, Seasons' Guide (Saviors of Kamigawa #148)",False,3
https://cards.scryfall.io/large/front/a/8/a873dbe5-d95a-4ecb-ac0a-8dc6c40f3576.jpg?1689999244,"Sek'Kuar, Deathkeeper (Commander Masters #354)",False,3
https://cards.scryfall.io/large/front/6/6/664b57e3-9476-4d6a-8301-5a2f96bcfbf7.jpg?1562429830,"Selenia, Dark Angel (Tempest Remastered #210)",False,2
https://cards.scryfall.io/large/front/2/8/28c1b84a-a21b-4df1-9fc9-5b387fb56810.jpg?1706241026,"Selvala, Explorer Returned (Murders at Karlov Manor Commander #218)",False,2
https://cards.scryfall.io/large/front/7/d/7d711cb2-4f34-4792-90d7-2be5d329a347.jpg?1689998846,"Selvala, Heart of the Wilds (Commander Masters #320)",False,2
https://cards.scryfall.io/large/front/8/7/8778b33c-efab-4b65-b6e3-f0e3d1d8f937.jpg?1706239557,Senator Peacock (Ravnica: Clue Edition #2),False,2
https://cards.scryfall.io/large/front/4/d/4d51a22e-74fc-442e-945a-56d02ca12713.jpg?1608909947,"Sengir, the Dark Baron (Commander Legends #149)",False,2
https://cards.scryfall.io/large/front/b/9/b93dd897-3fb5-48b1-bdff-9383ce1feb21.jpg?1562763745,Sensei Golden-Tail (Champions of Kamigawa #44),False,1
https://cards.scryfall.io/large/front/2/3/23b76965-528c-48f9-9ee6-332b09cae664.jpg?1708742632,Sentinel Sarah Lyons (Fallout #118),False,2
https://cards.scryfall.io/large/front/1/3/13ac5292-9817-4f5d-b3fa-611f9ba44443.jpg?1599708366,Sen Triplets (Double Masters #218),False,3
https://cards.scryfall.io/large/front/7/2/729ee848-6c27-4202-b2bc-605f45209468.jpg?1689995989,"Sephara, Sky's Blade (Commander Masters #54)",False,3
https://cards.scryfall.io/large/front/0/1/01f40e07-f565-4b9e-87a5-5b28b4e9fb0b.jpg?1696636767,Sergeant John Benton (Doctor Who #157),False,2
https://cards.scryfall.io/large/front/3/8/3823e561-5a0a-4020-9322-a2b481499807.jpg?1562759347,Seshiro the Anointed (Champions of Kamigawa #241),False,2
https://cards.scryfall.io/large/front/2/7/274cdb39-1454-4c9b-acd8-4f762a48e71f.jpg?1632261849,"Sethron, Hurloon General (Jumpstart #25)",False,2
https://cards.scryfall.io/large/front/6/4/641a3bae-9146-4e70-862a-86a56f7c3816.jpg?1562913548,"Seton, Krosan Protector (Odyssey #267)",False,3
https://cards.scryfall.io/large/front/2/c/2c209efe-b4dc-44a3-bd45-d647f5680cbe.jpg?1568003729,"Sevinne, the Chronoclasm (Commander 2019 #49)",False,3
https://cards.scryfall.io/large/front/9/9/9955d172-0b24-4c61-9dee-c935a1f26da2.jpg?1591234288,"Shabraz, the Skyshark (Commander 2020 #14)",False,2
https://cards.scryfall.io/large/front/4/c/4c7d861d-7832-4c15-8d6c-8c07a9a57891.jpg?1686970028,"Shadowfax, Lord of Horses (The Lord of the Rings: Tales of Middle-earth #227)",False,2
https://cards.scryfall.io/large/front/1/3/13a0913d-776b-4ef8-adef-8861349df2b5.jpg?1674136288,"Shadowheart, Dark Justiciar (Commander Legends: Battle for Baldur's Gate #146)",False,1
https://cards.scryfall.io/large/front/0/a/0a6e81c8-7118-4c54-93b2-f1e8134446d2.jpg?1656629476,"Shadowheart, Sharran Cleric (Alchemy Horizons: Baldur's Gate #10)",False,1
https://cards.scryfall.io/large/front/a/b/ab701909-83d6-4d39-9a84-e6a9b2cb38d6.jpg?1624739966,Shadrix Silverquill (Strixhaven: School of Mages #230),False,2
https://cards.scryfall.io/large/front/0/7/0731f64a-15da-4814-82e9-3a42e1657f36.jpg?1686970039,"Shagrat, Loot Bearer (The Lord of the Rings: Tales of Middle-earth #228)",False,2
https://cards.scryfall.io/large/front/9/3/938cee8f-ac2c-49a5-9ff7-1367d0edfabe.jpg?1634060541,"Shaile, Dean of Radiance // Embrose, Dean of Shadow (Strixhaven: School of Mages #158)",True,1
https://cards.scryfall.io/large/front/8/0/80804f25-efc3-44a2-bbae-9a97fec98009.jpg?1682207281,Shalai and Hallar (March of the Machine Commander #10),False,3
https://cards.scryfall.io/large/front/d/b/db827ee7-6f2e-4e10-aac0-120fc2b69fbd.jpg?1562743987,"Shalai, Voice of Plenty (Dominaria #35)",False,1
https://cards.scryfall.io/large/front/e/6/e65ad0e2-8f78-4e60-a97e-1cd20901680f.jpg?1674135800,Shameless Charlatan (Commander Legends: Battle for Baldur's Gate #96),False,1
https://cards.scryfall.io/large/front/1/b/1b0fb859-055d-4aa1-814c-0894cd2ccd4a.jpg?1673304703,"Shanid, Sleepers' Scourge (Dominaria United Commander #4)",False,3
https://cards.scryfall.io/large/front/7/2/7261c443-8d27-4d85-8027-2a0271b85e07.jpg?1673308081,"Shanna, Purifying Blade (Dominaria United #218)",False,3
https://cards.scryfall.io/large/front/b/9/b90df81c-d738-46b3-8e96-9db0b3507ee0.jpg?1562741797,"Shanna, Sisay's Legacy (Dominaria #204)",False,2
https://cards.scryfall.io/large/front/6/0/600bc36a-3ef0-459c-9a93-94ec45b8c3d9.jpg?1692939438,Sharae of Numbing Depths (Wilds of Eldraine #213),False,2
https://cards.scryfall.io/large/front/e/0/e0e446bd-8295-4fca-957a-e4710a15d8e8.jpg?1686970050,"Sharkey, Tyrant of the Shire (The Lord of the Rings: Tales of Middle-earth #229)",False,2
https://cards.scryfall.io/large/front/a/f/af80ef38-ab95-476f-b0dd-b5ef3e9bceab.jpg?1599708380,Sharuum the Hegemon (Double Masters #219),False,3
https://cards.scryfall.io/large/front/5/2/52a30e27-4c52-4191-8541-e25732a2dd42.jpg?1673149130,Shattergang Brothers (Double Masters 2022 #275),False,3
https://cards.scryfall.io/large/front/0/6/06d94b21-7568-4e5c-a8ec-ff5bb48a4f36.jpg?1562717818,"Shauku, Endbringer (Mirage #142)",False,2
https://cards.scryfall.io/large/front/6/8/68af449f-3c30-43ea-be60-d85061d7adbd.jpg?1708742641,"Shaun, Father of Synths (Fallout #119)",False,2
https://cards.scryfall.io/large/front/a/1/a14c4b29-3363-45ce-9190-0f79e1a0ef7f.jpg?1686970060,"Shelob, Child of Ungoliant (The Lord of the Rings: Tales of Middle-earth #230)",False,2
https://cards.scryfall.io/large/front/8/3/83944c19-6f9b-4043-9eeb-1a4ca452f698.jpg?1686963969,"Shelob, Dread Weaver (Tales of Middle-earth Commander #29)",False,1
https://cards.scryfall.io/large/front/d/6/d67be074-cdd4-41d9-ac89-0a0456c4e4b2.jpg?1674057568,"Sheoldred, the Apocalypse (Dominaria United #107)",False,2
